title,authors,year,subject,cover_url,filename,doc_id,dominant_color,surrogate_text
The Canterbury Tales,"Geoffrey Chaucer, John E. Cunningham, Peter Ackroyd, Ted Stearn, V. A. Kolve, Glending Olson",1478,biography,http://covers.openlibrary.org/b/id/5767180-L.jpg,book_covers\1968_The_Canterbury_Tales.jpg,1968,"rgb(214, 203, 165)","The Canterbury Tales Geoffrey Chaucer, John E. Cunningham, Peter Ackroyd, Ted Stearn, V. A. Kolve, Glending Olson biography 1478 rgb(214, 203, 165)"
Leaves of Grass,Walt Whitman,1855,biography,http://covers.openlibrary.org/b/id/9000447-L.jpg,book_covers\1969_Leaves_of_Grass.jpg,1969,"rgb(132, 140, 76)","Leaves of Grass Walt Whitman biography 1855 rgb(132, 140, 76)"
Julius Caesar,William Shakespeare,1684,biography,http://covers.openlibrary.org/b/id/7901303-L.jpg,book_covers\1970_Julius_Caesar.jpg,1970,"rgb(203, 183, 145)","Julius Caesar William Shakespeare biography 1684 rgb(203, 183, 145)"
Dubliners,James Joyce,1914,biography,http://covers.openlibrary.org/b/id/8216412-L.jpg,book_covers\1971_Dubliners.jpg,1971,"rgb(55, 19, 24)","Dubliners James Joyce biography 1914 rgb(55, 19, 24)"
The Pilgrim's Progress,John Bunyan,1678,biography,http://covers.openlibrary.org/b/id/8229224-L.jpg,book_covers\1972_The_Pilgrim's_Progress.jpg,1972,"rgb(205, 170, 108)","The Pilgrim's Progress John Bunyan biography 1678 rgb(205, 170, 108)"
Autobiography,"Benjamin Franklin, Horatio Hastings Weld, Charles W. Eliot, James Zimmerhoff, Charles Eliot",1791,biography,http://covers.openlibrary.org/b/id/5647361-L.jpg,book_covers\1973_Autobiography.jpg,1973,"rgb(131, 109, 94)","Autobiography Benjamin Franklin, Horatio Hastings Weld, Charles W. Eliot, James Zimmerhoff, Charles Eliot biography 1791 rgb(131, 109, 94)"
The Second Jungle Book,Rudyard Kipling,1887,biography,http://covers.openlibrary.org/b/id/2140514-L.jpg,book_covers\1974_The_Second_Jungle_Book.jpg,1974,"rgb(197, 175, 149)","The Second Jungle Book Rudyard Kipling biography 1887 rgb(197, 175, 149)"
Sonnets,William Shakespeare,1609,biography,http://covers.openlibrary.org/b/id/8222090-L.jpg,book_covers\1975_Sonnets.jpg,1975,"rgb(36, 37, 50)","Sonnets William Shakespeare biography 1609 rgb(36, 37, 50)"
Ab urbe condita,Titus Livius,1481,biography,http://covers.openlibrary.org/b/id/6657951-L.jpg,book_covers\1976_Ab_urbe_condita.jpg,1976,"rgb(184, 169, 131)","Ab urbe condita Titus Livius biography 1481 rgb(184, 169, 131)"
The Tenant of Wildfell Hall,Anne Brontë,1847,biography,http://covers.openlibrary.org/b/id/1023552-L.jpg,book_covers\1977_The_Tenant_of_Wildfell_Hall.jpg,1977,"rgb(149, 104, 69)","The Tenant of Wildfell Hall Anne Brontë biography 1847 rgb(149, 104, 69)"
King Henry V,William Shakespeare,1600,biography,http://covers.openlibrary.org/b/id/7420215-L.jpg,book_covers\1978_King_Henry_V.jpg,1978,"rgb(220, 198, 153)","King Henry V William Shakespeare biography 1600 rgb(220, 198, 153)"
My bondage and my freedom,Frederick Douglass,1815,biography,http://covers.openlibrary.org/b/id/14847114-L.jpg,book_covers\1979_My_bondage_and_my_freedom.jpg,1979,"rgb(171, 148, 105)","My bondage and my freedom Frederick Douglass biography 1815 rgb(171, 148, 105)"
Walden,Henry David Thoreau,1854,biography,http://covers.openlibrary.org/b/id/11248037-L.jpg,book_covers\1980_Walden.jpg,1980,"rgb(144, 143, 137)","Walden Henry David Thoreau biography 1854 rgb(144, 143, 137)"
A history of New York,Washington Irving,1800,biography,http://covers.openlibrary.org/b/id/1991009-L.jpg,book_covers\1981_A_history_of_New_York.jpg,1981,"rgb(95, 69, 56)","A history of New York Washington Irving biography 1800 rgb(95, 69, 56)"
The  man who would be king,Rudyard Kipling,1898,biography,http://covers.openlibrary.org/b/id/6021425-L.jpg,book_covers\1982_The__man_who_would_be_king.jpg,1982,"rgb(240, 240, 240)","The  man who would be king Rudyard Kipling biography 1898 rgb(240, 240, 240)"
Manifest der Kommunistischen Partei,"Karl Marx, Friedrich Engels",1848,biography,http://covers.openlibrary.org/b/id/11048623-L.jpg,book_covers\1983_Manifest_der_Kommunistischen_Partei.jpg,1983,"rgb(127, 107, 85)","Manifest der Kommunistischen Partei Karl Marx, Friedrich Engels biography 1848 rgb(127, 107, 85)"
Confessions,Augustine of Hippo,1482,biography,http://covers.openlibrary.org/b/id/9022521-L.jpg,book_covers\1984_Confessions.jpg,1984,"rgb(119, 89, 85)","Confessions Augustine of Hippo biography 1482 rgb(119, 89, 85)"
Up from Slavery,Booker T. Washington,1900,biography,http://covers.openlibrary.org/b/id/119317-L.jpg,book_covers\1985_Up_from_Slavery.jpg,1985,"rgb(92, 86, 84)","Up from Slavery Booker T. Washington biography 1900 rgb(92, 86, 84)"
Roughing It,Mark Twain,1872,biography,http://covers.openlibrary.org/b/id/9165528-L.jpg,book_covers\1986_Roughing_It.jpg,1986,"rgb(80, 72, 63)","Roughing It Mark Twain biography 1872 rgb(80, 72, 63)"
Paradise Lost,John Milton,1667,biography,http://covers.openlibrary.org/b/id/5992814-L.jpg,book_covers\1987_Paradise_Lost.jpg,1987,"rgb(239, 216, 169)","Paradise Lost John Milton biography 1667 rgb(239, 216, 169)"
Incidents in the life of a slave girl,"Harriet A. Jacobs, Harriet Jacobs, Lydia Maria Child, Francine L. Jacobs, l. maria child, Carolyn L. Karcher, Jacobs, Hans Murray, Carla Fonte Sánchez, Carme Manuel Cuenca",1861,biography,http://covers.openlibrary.org/b/id/411542-L.jpg,book_covers\1988_Incidents_in_the_life_of_a_slave_girl.jpg,1988,"rgb(106, 59, 69)","Incidents in the life of a slave girl Harriet A. Jacobs, Harriet Jacobs, Lydia Maria Child, Francine L. Jacobs, l. maria child, Carolyn L. Karcher, Jacobs, Hans Murray, Carla Fonte Sánchez, Carme Manuel Cuenca biography 1861 rgb(106, 59, 69)"
Les fleurs du mal,Charles Baudelaire,1855,biography,http://covers.openlibrary.org/b/id/8236412-L.jpg,book_covers\1989_Les_fleurs_du_mal.jpg,1989,"rgb(182, 158, 104)","Les fleurs du mal Charles Baudelaire biography 1855 rgb(182, 158, 104)"
Lord Jim,Joseph Conrad,1900,biography,http://covers.openlibrary.org/b/id/8236295-L.jpg,book_covers\1990_Lord_Jim.jpg,1990,"rgb(67, 74, 54)","Lord Jim Joseph Conrad biography 1900 rgb(67, 74, 54)"
Lives,Plutarch,1564,biography,http://covers.openlibrary.org/b/id/10679669-L.jpg,book_covers\1991_Lives.jpg,1991,"rgb(155, 144, 104)","Lives Plutarch biography 1564 rgb(155, 144, 104)"
Saint Francis of Assisi,Gilbert Keith Chesterton,1923,biography,http://covers.openlibrary.org/b/id/502618-L.jpg,book_covers\1992_Saint_Francis_of_Assisi.jpg,1992,"rgb(143, 97, 81)","Saint Francis of Assisi Gilbert Keith Chesterton biography 1923 rgb(143, 97, 81)"
Two years before the mast,Richard Henry Dana,1000,biography,http://covers.openlibrary.org/b/id/8245243-L.jpg,book_covers\1993_Two_years_before_the_mast.jpg,1993,"rgb(66, 31, 15)","Two years before the mast Richard Henry Dana biography 1000 rgb(66, 31, 15)"
"The life of Olaudah Equiano, or Gustavus Vassa, the African","Olaudah Equiano, Robert J. Allison, Rebecka Rutledge Fisher",1789,biography,http://covers.openlibrary.org/b/id/2074044-L.jpg,"book_covers\1994_The_life_of_Olaudah_Equiano,_or_Gustavus_Vassa,_the_African.jpg",1994,"rgb(77, 47, 52)","The life of Olaudah Equiano, or Gustavus Vassa, the African Olaudah Equiano, Robert J. Allison, Rebecka Rutledge Fisher biography 1789 rgb(77, 47, 52)"
Sailing alone around the world,Joshua Slocum,1800,biography,http://covers.openlibrary.org/b/id/8247067-L.jpg,book_covers\1995_Sailing_alone_around_the_world.jpg,1995,"rgb(99, 114, 112)","Sailing alone around the world Joshua Slocum biography 1800 rgb(99, 114, 112)"
The complete poetical works,Robert Burns,1786,biography,http://covers.openlibrary.org/b/id/9048263-L.jpg,book_covers\1996_The_complete_poetical_works.jpg,1996,"rgb(131, 106, 100)","The complete poetical works Robert Burns biography 1786 rgb(131, 106, 100)"
The Magician,William Somerset Maugham,1908,biography,http://covers.openlibrary.org/b/id/2789948-L.jpg,book_covers\1997_The_Magician.jpg,1997,"rgb(244, 228, 171)","The Magician William Somerset Maugham biography 1908 rgb(244, 228, 171)"
Het Achterhuis,Anne Frank,1944,biography,http://covers.openlibrary.org/b/id/8584021-L.jpg,book_covers\1998_Het_Achterhuis.jpg,1998,"rgb(165, 105, 96)","Het Achterhuis Anne Frank biography 1944 rgb(165, 105, 96)"
"Tom Sawyer, Detective",Mark Twain,1897,biography,http://covers.openlibrary.org/b/id/8923621-L.jpg,"book_covers\1999_Tom_Sawyer,_Detective.jpg",1999,"rgb(188, 173, 135)","Tom Sawyer, Detective Mark Twain biography 1897 rgb(188, 173, 135)"
Acres of diamonds,"Russell Herman Conwell, Robert Shackleton - undifferentiated, John Wanamaker, Peter Williams - undifferentiated, Robert Collier, John Wanamaker",1901,biography,http://covers.openlibrary.org/b/id/5833160-L.jpg,book_covers\2000_Acres_of_diamonds.jpg,2000,"rgb(244, 244, 244)","Acres of diamonds Russell Herman Conwell, Robert Shackleton - undifferentiated, John Wanamaker, Peter Williams - undifferentiated, Robert Collier, John Wanamaker biography 1901 rgb(244, 244, 244)"
Erewhon,Samuel Butler,1872,biography,http://covers.openlibrary.org/b/id/825789-L.jpg,book_covers\2001_Erewhon.jpg,2001,"rgb(153, 155, 154)","Erewhon Samuel Butler biography 1872 rgb(153, 155, 154)"
"Maria; or, The Wrongs of Woman","Mary Wollstonecraft, William Godwin",1799,biography,http://covers.openlibrary.org/b/id/314559-L.jpg,"book_covers\2002_Maria;_or,_The_Wrongs_of_Woman.jpg",2002,"rgb(61, 56, 48)","Maria; or, The Wrongs of Woman Mary Wollstonecraft, William Godwin biography 1799 rgb(61, 56, 48)"
Plays (36),William Shakespeare,1623,biography,http://covers.openlibrary.org/b/id/9023411-L.jpg,book_covers\2003_Plays_(36).jpg,2003,"rgb(158, 155, 143)","Plays (36) William Shakespeare biography 1623 rgb(158, 155, 143)"
Ἀνάβασις,Xenophon,1623,biography,http://covers.openlibrary.org/b/id/6133592-L.jpg,book_covers\2004_Ἀνάβασις.jpg,2004,error_reading,Ἀνάβασις Xenophon biography 1623 error_reading
Captivity and Restoration,"Mary White Rowlandson, Joseph Rowlandson, Larvae Editions, Timothy Harrington, Caroline D. Grimm, Henry S. Nourse, John Eliot Thayer, John Williams, John 1664-1729 Williams, Henry S. (Henry Stedman) 183 Nourse, John Eliot 1862-1933 Edt Thayer",1682,biography,http://covers.openlibrary.org/b/id/1813688-L.jpg,book_covers\2005_Captivity_and_Restoration.jpg,2005,"rgb(189, 182, 127)","Captivity and Restoration Mary White Rowlandson, Joseph Rowlandson, Larvae Editions, Timothy Harrington, Caroline D. Grimm, Henry S. Nourse, John Eliot Thayer, John Williams, John 1664-1729 Williams, Henry S. (Henry Stedman) 183 Nourse, John Eliot 1862-1933 Edt Thayer biography 1682 rgb(189, 182, 127)"
The Library of American Biography,Jared Sparks,1846,biography,http://covers.openlibrary.org/b/id/13514238-L.jpg,book_covers\2006_The_Library_of_American_Biography.jpg,2006,"rgb(122, 126, 65)","The Library of American Biography Jared Sparks biography 1846 rgb(122, 126, 65)"
Les confessions,Jean-Jacques Rousseau,1782,biography,http://covers.openlibrary.org/b/id/6371045-L.jpg,book_covers\2007_Les_confessions.jpg,2007,"rgb(197, 186, 152)","Les confessions Jean-Jacques Rousseau biography 1782 rgb(197, 186, 152)"
Picasso,"Pablo Picasso, Jean-Louis Andral, Pierre Daix",1926,biography,http://covers.openlibrary.org/b/id/2238306-L.jpg,book_covers\2008_Picasso.jpg,2008,"rgb(148, 154, 135)","Picasso Pablo Picasso, Jean-Louis Andral, Pierre Daix biography 1926 rgb(148, 154, 135)"
Life of Samuel Johnson,James Boswell,1776,biography,http://covers.openlibrary.org/b/id/5785491-L.jpg,book_covers\2009_Life_of_Samuel_Johnson.jpg,2009,"rgb(155, 153, 138)","Life of Samuel Johnson James Boswell biography 1776 rgb(155, 153, 138)"
Poems,Samuel Taylor Coleridge,1796,biography,http://covers.openlibrary.org/b/id/11696250-L.jpg,book_covers\2010_Poems.jpg,2010,"rgb(49, 51, 49)","Poems Samuel Taylor Coleridge biography 1796 rgb(49, 51, 49)"
"The History of Rasselas, Prince of Abyssinia","Samuel Johnson, Warren L. Fleischauer, Félix Paknadel, Octavie Belot, James MacAulay",1759,biography,http://covers.openlibrary.org/b/id/2035834-L.jpg,"book_covers\2011_The_History_of_Rasselas,_Prince_of_Abyssinia.jpg",2011,"rgb(104, 117, 106)","The History of Rasselas, Prince of Abyssinia Samuel Johnson, Warren L. Fleischauer, Félix Paknadel, Octavie Belot, James MacAulay biography 1759 rgb(104, 117, 106)"
"Works [37 plays, 6 poems, sonnets]",William Shakespeare,1730,biography,http://covers.openlibrary.org/b/id/8779054-L.jpg,"book_covers\2012_Works_[37_plays,_6_poems,_sonnets].jpg",2012,"rgb(29, 40, 36)","Works [37 plays, 6 poems, sonnets] William Shakespeare biography 1730 rgb(29, 40, 36)"
Moralia,Plutarch,1500,biography,http://covers.openlibrary.org/b/id/5788251-L.jpg,book_covers\2013_Moralia.jpg,2013,"rgb(163, 156, 138)","Moralia Plutarch biography 1500 rgb(163, 156, 138)"
Мы,"Евгений Иванович Замятин, Gary Kern, Alejandro Ariel González, Tavo Montañez, Sergio Hernández-Ranera Sánchez, Zilboorg Gregory, Alexander Glinka",1924,biography,http://covers.openlibrary.org/b/id/5484189-L.jpg,book_covers\2014_Мы.jpg,2014,error_reading,"Мы Евгений Иванович Замятин, Gary Kern, Alejandro Ariel González, Tavo Montañez, Sergio Hernández-Ranera Sánchez, Zilboorg Gregory, Alexander Glinka biography 1924 error_reading"
Flush,"Virginia Woolf, Eileen Atkins, Katyuli Lloyd, Jose KING, Jordi Fernando, Rafael Vázquez Zamora",1694,biography,http://covers.openlibrary.org/b/id/116161-L.jpg,book_covers\2015_Flush.jpg,2015,"rgb(155, 95, 86)","Flush Virginia Woolf, Eileen Atkins, Katyuli Lloyd, Jose KING, Jordi Fernando, Rafael Vázquez Zamora biography 1694 rgb(155, 95, 86)"
Ben Hur,Lew Wallace,1800,biography,http://covers.openlibrary.org/b/id/6456470-L.jpg,book_covers\2016_Ben_Hur.jpg,2016,"rgb(89, 73, 55)","Ben Hur Lew Wallace biography 1800 rgb(89, 73, 55)"
Poems by John Keats,John Keats,1800,biography,http://covers.openlibrary.org/b/id/5635209-L.jpg,book_covers\2017_Poems_by_John_Keats.jpg,2017,"rgb(240, 237, 215)","Poems by John Keats John Keats biography 1800 rgb(240, 237, 215)"
Typee,Herman Melville,1840,biography,http://covers.openlibrary.org/b/id/9341648-L.jpg,book_covers\2018_Typee.jpg,2018,"rgb(108, 16, 15)","Typee Herman Melville biography 1840 rgb(108, 16, 15)"
A Tramp Abroad,Mark Twain,1878,biography,http://covers.openlibrary.org/b/id/9168741-L.jpg,book_covers\2019_A_Tramp_Abroad.jpg,2019,"rgb(34, 27, 15)","A Tramp Abroad Mark Twain biography 1878 rgb(34, 27, 15)"
Autobiography of a Yogi,Yogananda Paramahansa,1946,biography,http://covers.openlibrary.org/b/id/805448-L.jpg,book_covers\2020_Autobiography_of_a_Yogi.jpg,2020,"rgb(120, 138, 163)","Autobiography of a Yogi Yogananda Paramahansa biography 1946 rgb(120, 138, 163)"
American notes,"Charles Dickens, Diana C. Archibald",1800,biography,http://covers.openlibrary.org/b/id/8236357-L.jpg,book_covers\2021_American_notes.jpg,2021,"rgb(143, 91, 50)","American notes Charles Dickens, Diana C. Archibald biography 1800 rgb(143, 91, 50)"
The education of Henry Adams,Henry Adams,1777,biography,http://covers.openlibrary.org/b/id/8232012-L.jpg,book_covers\2022_The_education_of_Henry_Adams.jpg,2022,"rgb(160, 146, 117)","The education of Henry Adams Henry Adams biography 1777 rgb(160, 146, 117)"
The Man Without a Country,Edward Everett Hale,1865,biography,http://covers.openlibrary.org/b/id/8239495-L.jpg,book_covers\2023_The_Man_Without_a_Country.jpg,2023,"rgb(147, 129, 113)","The Man Without a Country Edward Everett Hale biography 1865 rgb(147, 129, 113)"
Hospital Sketches,Louisa May Alcott,1863,biography,http://covers.openlibrary.org/b/id/8029754-L.jpg,book_covers\2024_Hospital_Sketches.jpg,2024,"rgb(250, 242, 229)","Hospital Sketches Louisa May Alcott biography 1863 rgb(250, 242, 229)"
Diary,Samuel Pepys,1825,biography,http://covers.openlibrary.org/b/id/12742285-L.jpg,book_covers\2025_Diary.jpg,2025,"rgb(33, 67, 105)","Diary Samuel Pepys biography 1825 rgb(33, 67, 105)"
Das Schloß,Franz Kafka,1926,biography,http://covers.openlibrary.org/b/id/12605605-L.jpg,book_covers\2026_Das_Schloß.jpg,2026,error_reading,Das Schloß Franz Kafka biography 1926 error_reading
My life and work,"Ford, Henry, Henry Ford, Samuel Crowther, Henry, Ford, Ford Henry 1863-1947, Mrs Henry Ford, E. Kalita, Ford, Henry, Crowther, Samuel, Henry Henry Ford, Samuel Crowther",1922,biography,http://covers.openlibrary.org/b/id/1200056-L.jpg,book_covers\2027_My_life_and_work.jpg,2027,"rgb(46, 80, 67)","My life and work Ford, Henry, Henry Ford, Samuel Crowther, Henry, Ford, Ford Henry 1863-1947, Mrs Henry Ford, E. Kalita, Ford, Henry, Crowther, Samuel, Henry Henry Ford, Samuel Crowther biography 1922 rgb(46, 80, 67)"
Mademoiselle Fifi,Guy de Maupassant,1882,biography,http://covers.openlibrary.org/b/id/6468088-L.jpg,book_covers\2028_Mademoiselle_Fifi.jpg,2028,"rgb(177, 166, 142)","Mademoiselle Fifi Guy de Maupassant biography 1882 rgb(177, 166, 142)"
The Hudson Bay Company,"Robert Michael Ballantyne, Thomas Nelson and Sons",1848,biography,http://covers.openlibrary.org/b/id/1802733-L.jpg,book_covers\2029_The_Hudson_Bay_Company.jpg,2029,"rgb(245, 225, 158)","The Hudson Bay Company Robert Michael Ballantyne, Thomas Nelson and Sons biography 1848 rgb(245, 225, 158)"
Life on the Mississippi,Mark Twain,1883,biography,http://covers.openlibrary.org/b/id/9164717-L.jpg,book_covers\2030_Life_on_the_Mississippi.jpg,2030,"rgb(46, 32, 17)","Life on the Mississippi Mark Twain biography 1883 rgb(46, 32, 17)"
Paul Klee,Paul Klee,1930,biography,http://covers.openlibrary.org/b/id/13174486-L.jpg,book_covers\2031_Paul_Klee.jpg,2031,"rgb(124, 92, 50)","Paul Klee Paul Klee biography 1930 rgb(124, 92, 50)"
Henry Moore,"David Sylvester, Henry Moore, J. Hedgecoe, Alan Bowness, Herbert Edward Read, Ann Garrould",1934,biography,http://covers.openlibrary.org/b/id/1604103-L.jpg,book_covers\2032_Henry_Moore.jpg,2032,"rgb(164, 158, 163)","Henry Moore David Sylvester, Henry Moore, J. Hedgecoe, Alan Bowness, Herbert Edward Read, Ann Garrould biography 1934 rgb(164, 158, 163)"
"The adventures of Captain Bonneville, U.S.A.","Washington Irving, Benjamin Louis Eulalie De Bonneville",1800,biography,http://covers.openlibrary.org/b/id/8233401-L.jpg,"book_covers\2033_The_adventures_of_Captain_Bonneville,_U.S.A..jpg",2033,"rgb(242, 234, 222)","The adventures of Captain Bonneville, U.S.A. Washington Irving, Benjamin Louis Eulalie De Bonneville biography 1800 rgb(242, 234, 222)"
Exercitia spiritualia,"Saint Ignatius of Loyola, Aloysio R.P Bellecio, Ignatius., William, S.J. Reiser",1548,biography,http://covers.openlibrary.org/b/id/8027976-L.jpg,book_covers\2034_Exercitia_spiritualia.jpg,2034,"rgb(169, 152, 112)","Exercitia spiritualia Saint Ignatius of Loyola, Aloysio R.P Bellecio, Ignatius., William, S.J. Reiser biography 1548 rgb(169, 152, 112)"
Dei delitte e delle pene,Cesare Beccaria,1764,biography,http://covers.openlibrary.org/b/id/8553099-L.jpg,book_covers\2035_Dei_delitte_e_delle_pene.jpg,2035,"rgb(122, 114, 118)","Dei delitte e delle pene Cesare Beccaria biography 1764 rgb(122, 114, 118)"
Paul et Virginie,Bernardin de Saint-Pierre,1789,biography,http://covers.openlibrary.org/b/id/8243325-L.jpg,book_covers\2036_Paul_et_Virginie.jpg,2036,"rgb(151, 144, 85)","Paul et Virginie Bernardin de Saint-Pierre biography 1789 rgb(151, 144, 85)"
Elizabeth and Her German Garden,"Elizabeth von Arnim, Ulrich Baer",1898,biography,http://covers.openlibrary.org/b/id/652095-L.jpg,book_covers\2037_Elizabeth_and_Her_German_Garden.jpg,2037,"rgb(65, 61, 52)","Elizabeth and Her German Garden Elizabeth von Arnim, Ulrich Baer biography 1898 rgb(65, 61, 52)"
An autobiography,"Mohandas Karamchand Gandhi, Mahadev Desai, Tridip Suhrud, Bill Wallace, D. Fog, Emi K, Beatrice Tanaka, Muriel Muller, Shekhar Verma",1927,biography,http://covers.openlibrary.org/b/id/108086-L.jpg,book_covers\2038_An_autobiography.jpg,2038,"rgb(219, 215, 209)","An autobiography Mohandas Karamchand Gandhi, Mahadev Desai, Tridip Suhrud, Bill Wallace, D. Fog, Emi K, Beatrice Tanaka, Muriel Muller, Shekhar Verma biography 1927 rgb(219, 215, 209)"
History of Alexander the Great,Jacob Abbott,1848,biography,http://covers.openlibrary.org/b/id/6946256-L.jpg,book_covers\2039_History_of_Alexander_the_Great.jpg,2039,"rgb(148, 118, 66)","History of Alexander the Great Jacob Abbott biography 1848 rgb(148, 118, 66)"
Oliver Goldsmith,Washington Irving,1840,biography,http://covers.openlibrary.org/b/id/8242982-L.jpg,book_covers\2040_Oliver_Goldsmith.jpg,2040,"rgb(112, 68, 26)","Oliver Goldsmith Washington Irving biography 1840 rgb(112, 68, 26)"
De officiis,Cicero,1465,biography,http://covers.openlibrary.org/b/id/6487218-L.jpg,book_covers\2041_De_officiis.jpg,2041,"rgb(207, 200, 166)","De officiis Cicero biography 1465 rgb(207, 200, 166)"
A Mind That Found Itself,Clifford Whittingham Beers,1908,biography,http://covers.openlibrary.org/b/id/10857476-L.jpg,book_covers\2042_A_Mind_That_Found_Itself.jpg,2042,"rgb(49, 53, 39)","A Mind That Found Itself Clifford Whittingham Beers biography 1908 rgb(49, 53, 39)"
"Margaret Ogilvy, and others",J. M. Barrie,1896,biography,http://covers.openlibrary.org/b/id/5748062-L.jpg,"book_covers\2043_Margaret_Ogilvy,_and_others.jpg",2043,"rgb(240, 226, 195)","Margaret Ogilvy, and others J. M. Barrie biography 1896 rgb(240, 226, 195)"
Bambi (First Colouring Tall),"Felix Salten, Walt Disney, Benjamin Lacombe, Nicolas Waquet, Christine Palluy, Carine Hinder, Jack Zipes, Weise Kurt, Whittaker Chambers, Begoña G. Arce, María Alonso Seisdedos",1861,biography,http://covers.openlibrary.org/b/id/7153939-L.jpg,book_covers\2044_Bambi_(First_Colouring_Tall).jpg,2044,"rgb(35, 57, 41)","Bambi (First Colouring Tall) Felix Salten, Walt Disney, Benjamin Lacombe, Nicolas Waquet, Christine Palluy, Carine Hinder, Jack Zipes, Weise Kurt, Whittaker Chambers, Begoña G. Arce, María Alonso Seisdedos biography 1861 rgb(35, 57, 41)"
Houghton Mifflin the Nation's Choice,Houghton Mifflin Company Staff,2000,biography,http://covers.openlibrary.org/b/id/13518382-L.jpg,book_covers\2045_Houghton_Mifflin_the_Nation's_Choice.jpg,2045,"rgb(211, 111, 40)","Houghton Mifflin the Nation's Choice Houghton Mifflin Company Staff biography 2000 rgb(211, 111, 40)"
The lives of the XII. Cæsars,"Suetonius, R. E. J. Fitzpatrick",1470,biography,http://covers.openlibrary.org/b/id/8242755-L.jpg,book_covers\2046_The_lives_of_the_XII._Cæsars.jpg,2046,error_reading,"The lives of the XII. Cæsars Suetonius, R. E. J. Fitzpatrick biography 1470 error_reading"
The Life of Charlotte Bronte,Elizabeth Cleghorn Gaskell,1857,biography,http://covers.openlibrary.org/b/id/2748823-L.jpg,book_covers\2047_The_Life_of_Charlotte_Bronte.jpg,2047,"rgb(252, 252, 252)","The Life of Charlotte Bronte Elizabeth Cleghorn Gaskell biography 1857 rgb(252, 252, 252)"
"Seven pillars of wisdom, a triumph",T. E. Lawrence,1905,biography,http://covers.openlibrary.org/b/id/1448352-L.jpg,"book_covers\2048_Seven_pillars_of_wisdom,_a_triumph.jpg",2048,"rgb(247, 220, 125)","Seven pillars of wisdom, a triumph T. E. Lawrence biography 1905 rgb(247, 220, 125)"
Cyropaedia,Xenophon,1527,biography,http://covers.openlibrary.org/b/id/6062894-L.jpg,book_covers\2049_Cyropaedia.jpg,2049,"rgb(196, 160, 91)","Cyropaedia Xenophon biography 1527 rgb(196, 160, 91)"
Dictionary of National Biography,"George Murray Smith, Sir Sidney Lee, Sir Leslie Stephen",1885,biography,http://covers.openlibrary.org/b/id/1276873-L.jpg,book_covers\2050_Dictionary_of_National_Biography.jpg,2050,"rgb(87, 34, 28)","Dictionary of National Biography George Murray Smith, Sir Sidney Lee, Sir Leslie Stephen biography 1885 rgb(87, 34, 28)"
The Second World War,Winston S. Churchill,1948,biography,http://covers.openlibrary.org/b/id/7347623-L.jpg,book_covers\2051_The_Second_World_War.jpg,2051,"rgb(38, 31, 35)","The Second World War Winston S. Churchill biography 1948 rgb(38, 31, 35)"
Grace abounding to the chief of sinners,John Bunyan,1666,biography,http://covers.openlibrary.org/b/id/8241323-L.jpg,book_covers\2052_Grace_abounding_to_the_chief_of_sinners.jpg,2052,"rgb(71, 61, 25)","Grace abounding to the chief of sinners John Bunyan biography 1666 rgb(71, 61, 25)"
Adolphe,"Benjamin Constant, B. Constant, Benjamin Constant, Nicolson, Harold George Sir, Carl Wildman",1817,biography,http://covers.openlibrary.org/b/id/2154092-L.jpg,book_covers\2053_Adolphe.jpg,2053,"rgb(103, 103, 91)","Adolphe Benjamin Constant, B. Constant, Benjamin Constant, Nicolson, Harold George Sir, Carl Wildman biography 1817 rgb(103, 103, 91)"
Their Wedding Journey,William Dean Howells,1872,biography,http://covers.openlibrary.org/b/id/14822344-L.jpg,book_covers\2054_Their_Wedding_Journey.jpg,2054,"rgb(61, 53, 32)","Their Wedding Journey William Dean Howells biography 1872 rgb(61, 53, 32)"
"The journals of André Gide, 1889-1949","André Gide, Laura Freixas, Ignacio Vidal-Folch Balanzo, Ignacio Vidal-Folch Balanzo",1939,biography,http://covers.openlibrary.org/b/id/6519760-L.jpg,"book_covers\2055_The_journals_of_André_Gide,_1889-1949.jpg",2055,error_reading,"The journals of André Gide, 1889-1949 André Gide, Laura Freixas, Ignacio Vidal-Folch Balanzo, Ignacio Vidal-Folch Balanzo biography 1939 error_reading"
Apologia pro vita sua,John Henry Newman,1860,biography,http://covers.openlibrary.org/b/id/8242161-L.jpg,book_covers\2056_Apologia_pro_vita_sua.jpg,2056,"rgb(107, 100, 84)","Apologia pro vita sua John Henry Newman biography 1860 rgb(107, 100, 84)"
20 Years at Hull House,Jane Addams,1910,biography,http://covers.openlibrary.org/b/id/700557-L.jpg,book_covers\2057_20_Years_at_Hull_House.jpg,2057,"rgb(160, 158, 158)","20 Years at Hull House Jane Addams biography 1910 rgb(160, 158, 158)"
Columbus,Washington Irving,1800,biography,http://covers.openlibrary.org/b/id/5890614-L.jpg,book_covers\2058_Columbus.jpg,2058,"rgb(182, 169, 148)","Columbus Washington Irving biography 1800 rgb(182, 169, 148)"
