title,authors,year,subject,cover_url,filename,doc_id,dominant_color,surrogate_text
Glinda of Oz,L. Frank Baum,1920,classic_literature,http://covers.openlibrary.org/b/id/758814-L.jpg,book_covers\2821_Glinda_of_Oz.jpg,2821,"rgb(252, 252, 252)","Glinda of Oz L. Frank Baum classic_literature 1920 rgb(252, 252, 252)"
Heart of Darkness,Joseph Conrad,1899,classic_literature,http://covers.openlibrary.org/b/id/12307847-L.jpg,book_covers\2822_Heart_of_Darkness.jpg,2822,"rgb(69, 68, 90)","Heart of Darkness Joseph Conrad classic_literature 1899 rgb(69, 68, 90)"
La dame aux camélias [novel],Alexandre Dumas fils,1848,classic_literature,http://covers.openlibrary.org/b/id/14565226-L.jpg,book_covers\2823_La_dame_aux_camélias_[novel].jpg,2823,error_reading,La dame aux camélias [novel] Alexandre Dumas fils classic_literature 1848 error_reading
Little men,Louisa May Alcott,1885,classic_literature,http://covers.openlibrary.org/b/id/8043576-L.jpg,book_covers\2824_Little_men.jpg,2824,"rgb(199, 195, 173)","Little men Louisa May Alcott classic_literature 1885 rgb(199, 195, 173)"
Confessions,Augustine of Hippo,1482,classic_literature,http://covers.openlibrary.org/b/id/9022521-L.jpg,book_covers\2825_Confessions.jpg,2825,"rgb(119, 89, 85)","Confessions Augustine of Hippo classic_literature 1482 rgb(119, 89, 85)"
Flower Fables,Louisa May Alcott,1854,classic_literature,http://covers.openlibrary.org/b/id/755980-L.jpg,book_covers\2826_Flower_Fables.jpg,2826,"rgb(73, 43, 9)","Flower Fables Louisa May Alcott classic_literature 1854 rgb(73, 43, 9)"
Silas Marner,George Eliot,1860,classic_literature,http://covers.openlibrary.org/b/id/9286405-L.jpg,book_covers\2827_Silas_Marner.jpg,2827,"rgb(36, 34, 24)","Silas Marner George Eliot classic_literature 1860 rgb(36, 34, 24)"
The Importance of Being Earnest,Oscar Wilde,1893,classic_literature,http://covers.openlibrary.org/b/id/1260453-L.jpg,book_covers\2828_The_Importance_of_Being_Earnest.jpg,2828,"rgb(237, 236, 210)","The Importance of Being Earnest Oscar Wilde classic_literature 1893 rgb(237, 236, 210)"
Inferno,Dante Alighieri,1767,classic_literature,http://covers.openlibrary.org/b/id/6387077-L.jpg,book_covers\2829_Inferno.jpg,2829,"rgb(67, 31, 25)","Inferno Dante Alighieri classic_literature 1767 rgb(67, 31, 25)"
The Chimes,"Charles Dickens, Richard Doyle, William Clarkson Stanfield, Sajad Hussain, Oscar Ellis, Michael Clay Thompson",1800,classic_literature,http://covers.openlibrary.org/b/id/9284863-L.jpg,book_covers\2830_The_Chimes.jpg,2830,"rgb(95, 32, 33)","The Chimes Charles Dickens, Richard Doyle, William Clarkson Stanfield, Sajad Hussain, Oscar Ellis, Michael Clay Thompson classic_literature 1800 rgb(95, 32, 33)"
A la recherche du temps perdu,Marcel Proust,1914,classic_literature,http://covers.openlibrary.org/b/id/12332709-L.jpg,book_covers\2831_A_la_recherche_du_temps_perdu.jpg,2831,"rgb(94, 73, 55)","A la recherche du temps perdu Marcel Proust classic_literature 1914 rgb(94, 73, 55)"
The History of Tom Jones,Henry Fielding,1749,classic_literature,http://covers.openlibrary.org/b/id/12968864-L.jpg,book_covers\2832_The_History_of_Tom_Jones.jpg,2832,"rgb(76, 17, 4)","The History of Tom Jones Henry Fielding classic_literature 1749 rgb(76, 17, 4)"
Metamorphoses,"Lucius Apuleius, William Adlington, Lucio Apuleyo, pixabay, Apuleius",1500,classic_literature,http://covers.openlibrary.org/b/id/6596872-L.jpg,book_covers\2833_Metamorphoses.jpg,2833,"rgb(188, 164, 122)","Metamorphoses Lucius Apuleius, William Adlington, Lucio Apuleyo, pixabay, Apuleius classic_literature 1500 rgb(188, 164, 122)"
Barchester Towers,Anthony Trollope,1857,classic_literature,http://covers.openlibrary.org/b/id/1468666-L.jpg,book_covers\2834_Barchester_Towers.jpg,2834,"rgb(158, 142, 123)","Barchester Towers Anthony Trollope classic_literature 1857 rgb(158, 142, 123)"
Nineteen Eighty-Four,George Orwell,1949,classic_literature,http://covers.openlibrary.org/b/id/9267242-L.jpg,book_covers\2835_Nineteen_Eighty-Four.jpg,2835,"rgb(149, 139, 126)","Nineteen Eighty-Four George Orwell classic_literature 1949 rgb(149, 139, 126)"
Le avventure di Pinocchio,Carlo Collodi,1883,classic_literature,http://covers.openlibrary.org/b/id/8597022-L.jpg,book_covers\2836_Le_avventure_di_Pinocchio.jpg,2836,"rgb(212, 212, 172)","Le avventure di Pinocchio Carlo Collodi classic_literature 1883 rgb(212, 212, 172)"
The War of the Worlds,H. G. Wells,1898,classic_literature,http://covers.openlibrary.org/b/id/36314-L.jpg,book_covers\2837_The_War_of_the_Worlds.jpg,2837,"rgb(160, 121, 56)","The War of the Worlds H. G. Wells classic_literature 1898 rgb(160, 121, 56)"
Peter Pan,J. M. Barrie,1911,classic_literature,http://covers.openlibrary.org/b/id/8237052-L.jpg,book_covers\2838_Peter_Pan.jpg,2838,"rgb(132, 113, 36)","Peter Pan J. M. Barrie classic_literature 1911 rgb(132, 113, 36)"
The Pathfinder,James Fenimore Cooper,1800,classic_literature,http://covers.openlibrary.org/b/id/8980913-L.jpg,book_covers\2839_The_Pathfinder.jpg,2839,"rgb(123, 106, 99)","The Pathfinder James Fenimore Cooper classic_literature 1800 rgb(123, 106, 99)"
The Woman in White,Wilkie Collins,1860,classic_literature,http://covers.openlibrary.org/b/id/4684227-L.jpg,book_covers\2840_The_Woman_in_White.jpg,2840,"rgb(118, 96, 73)","The Woman in White Wilkie Collins classic_literature 1860 rgb(118, 96, 73)"
Le Tour du Monde en Quatre-Vingts Jours,Jules Verne,1872,classic_literature,http://covers.openlibrary.org/b/id/6976035-L.jpg,book_covers\2841_Le_Tour_du_Monde_en_Quatre-Vingts_Jours.jpg,2841,"rgb(58, 70, 41)","Le Tour du Monde en Quatre-Vingts Jours Jules Verne classic_literature 1872 rgb(58, 70, 41)"
The Golden Age,"Kenneth Grahame, Ernest H. Shepard",1879,classic_literature,http://covers.openlibrary.org/b/id/6330294-L.jpg,book_covers\2842_The_Golden_Age.jpg,2842,"rgb(144, 136, 99)","The Golden Age Kenneth Grahame, Ernest H. Shepard classic_literature 1879 rgb(144, 136, 99)"
De la démocratie en Amérique,"Alexis de Tocqueville, Gustave de Beaumont, Eduardo Nolla, Henry Reeve, John Canfield Spencer, J. P. Mayer",1835,classic_literature,http://covers.openlibrary.org/b/id/45979-L.jpg,book_covers\2843_De_la_démocratie_en_Amérique.jpg,2843,error_reading,"De la démocratie en Amérique Alexis de Tocqueville, Gustave de Beaumont, Eduardo Nolla, Henry Reeve, John Canfield Spencer, J. P. Mayer classic_literature 1835 error_reading"
Phantastes,George MacDonald,1850,classic_literature,http://covers.openlibrary.org/b/id/14358814-L.jpg,book_covers\2844_Phantastes.jpg,2844,"rgb(33, 54, 49)","Phantastes George MacDonald classic_literature 1850 rgb(33, 54, 49)"
Bleak House,"Charles Dickens, Kingfisher Classics, Andronum, Sylvère Monod, Aurélien Bellanger",1850,classic_literature,http://covers.openlibrary.org/b/id/9279273-L.jpg,book_covers\2845_Bleak_House.jpg,2845,"rgb(116, 149, 140)","Bleak House Charles Dickens, Kingfisher Classics, Andronum, Sylvère Monod, Aurélien Bellanger classic_literature 1850 rgb(116, 149, 140)"
The Invisible Man,H. G. Wells,1897,classic_literature,http://covers.openlibrary.org/b/id/6419199-L.jpg,book_covers\2846_The_Invisible_Man.jpg,2846,"rgb(91, 130, 127)","The Invisible Man H. G. Wells classic_literature 1897 rgb(91, 130, 127)"
The Souls of Black Folk,W. E. B. Du Bois,1903,classic_literature,http://covers.openlibrary.org/b/id/6564090-L.jpg,book_covers\2847_The_Souls_of_Black_Folk.jpg,2847,"rgb(142, 120, 95)","The Souls of Black Folk W. E. B. Du Bois classic_literature 1903 rgb(142, 120, 95)"
Of Human Bondage,William Somerset Maugham,1915,classic_literature,http://covers.openlibrary.org/b/id/5277723-L.jpg,book_covers\2848_Of_Human_Bondage.jpg,2848,"rgb(110, 106, 86)","Of Human Bondage William Somerset Maugham classic_literature 1915 rgb(110, 106, 86)"
Преступление и наказание,Фёдор Михайлович Достоевский,1866,classic_literature,http://covers.openlibrary.org/b/id/9411873-L.jpg,book_covers\2849_Преступление_и_наказание.jpg,2849,error_reading,Преступление и наказание Фёдор Михайлович Достоевский classic_literature 1866 error_reading
King Richard III,William Shakespeare,1597,classic_literature,http://covers.openlibrary.org/b/id/9020720-L.jpg,book_covers\2850_King_Richard_III.jpg,2850,"rgb(119, 102, 65)","King Richard III William Shakespeare classic_literature 1597 rgb(119, 102, 65)"
The Prairie,James Fenimore Cooper,1800,classic_literature,http://covers.openlibrary.org/b/id/5578106-L.jpg,book_covers\2851_The_Prairie.jpg,2851,"rgb(180, 152, 128)","The Prairie James Fenimore Cooper classic_literature 1800 rgb(180, 152, 128)"
Much Ado About Nothing,William Shakespeare,1600,classic_literature,http://covers.openlibrary.org/b/id/8290853-L.jpg,book_covers\2852_Much_Ado_About_Nothing.jpg,2852,"rgb(146, 112, 62)","Much Ado About Nothing William Shakespeare classic_literature 1600 rgb(146, 112, 62)"
The Woodlanders,Thomas Hardy,1800,classic_literature,http://covers.openlibrary.org/b/id/8243078-L.jpg,book_covers\2853_The_Woodlanders.jpg,2853,"rgb(222, 53, 48)","The Woodlanders Thomas Hardy classic_literature 1800 rgb(222, 53, 48)"
The Life and Adventures of Nicholas Nickleby,"Charles Dickens, David Foulds, Anne De Graaf, Chris Rice, Gustav Schrotter, Colin Mayne, Mr Philip Gooden, Pipi Sposito, P. Lorain, Paul Lorain, Francisco Manuel GRANADO CASTRO, Hablot BROWNE, Fred BARNARD, Pedro Horrach Salas, David González",1800,classic_literature,http://covers.openlibrary.org/b/id/9283905-L.jpg,book_covers\2854_The_Life_and_Adventures_of_Nicholas_Nickleby.jpg,2854,"rgb(39, 40, 25)","The Life and Adventures of Nicholas Nickleby Charles Dickens, David Foulds, Anne De Graaf, Chris Rice, Gustav Schrotter, Colin Mayne, Mr Philip Gooden, Pipi Sposito, P. Lorain, Paul Lorain, Francisco Manuel GRANADO CASTRO, Hablot BROWNE, Fred BARNARD, Pedro Horrach Salas, David González classic_literature 1800 rgb(39, 40, 25)"
Incidents in the life of a slave girl,"Harriet A. Jacobs, Harriet Jacobs, Lydia Maria Child, Francine L. Jacobs, l. maria child, Carolyn L. Karcher, Jacobs, Hans Murray, Carla Fonte Sánchez, Carme Manuel Cuenca",1861,classic_literature,http://covers.openlibrary.org/b/id/411542-L.jpg,book_covers\2855_Incidents_in_the_life_of_a_slave_girl.jpg,2855,"rgb(106, 59, 69)","Incidents in the life of a slave girl Harriet A. Jacobs, Harriet Jacobs, Lydia Maria Child, Francine L. Jacobs, l. maria child, Carolyn L. Karcher, Jacobs, Hans Murray, Carla Fonte Sánchez, Carme Manuel Cuenca classic_literature 1861 rgb(106, 59, 69)"
Vingt mille lieues sous les mers,"Jules Verne, Serge Micheli, Francois Riviere",1870,classic_literature,http://covers.openlibrary.org/b/id/6573517-L.jpg,book_covers\2856_Vingt_mille_lieues_sous_les_mers.jpg,2856,"rgb(193, 182, 154)","Vingt mille lieues sous les mers Jules Verne, Serge Micheli, Francois Riviere classic_literature 1870 rgb(193, 182, 154)"
The moon and sixpence,William Somerset Maugham,1919,classic_literature,http://covers.openlibrary.org/b/id/314604-L.jpg,book_covers\2857_The_moon_and_sixpence.jpg,2857,"rgb(129, 107, 76)","The moon and sixpence William Somerset Maugham classic_literature 1919 rgb(129, 107, 76)"
कामसूत्र,"Vatsyāyana, Alfredo B. Bedoya, Richard Burton",1883,classic_literature,http://covers.openlibrary.org/b/id/8003766-L.jpg,book_covers\2858_कामसूत्र.jpg,2858,error_reading,"कामसूत्र Vatsyāyana, Alfredo B. Bedoya, Richard Burton classic_literature 1883 error_reading"
Agnes Grey,Anne Brontë,1847,classic_literature,http://covers.openlibrary.org/b/id/8242924-L.jpg,book_covers\2859_Agnes_Grey.jpg,2859,"rgb(59, 55, 35)","Agnes Grey Anne Brontë classic_literature 1847 rgb(59, 55, 35)"
The pioneers,James Fenimore Cooper,1800,classic_literature,http://covers.openlibrary.org/b/id/9000512-L.jpg,book_covers\2860_The_pioneers.jpg,2860,"rgb(118, 72, 33)","The pioneers James Fenimore Cooper classic_literature 1800 rgb(118, 72, 33)"
The uncommercial traveller,"Charles Dickens, Pedro Tena",1776,classic_literature,http://covers.openlibrary.org/b/id/9284872-L.jpg,book_covers\2861_The_uncommercial_traveller.jpg,2861,"rgb(146, 113, 100)","The uncommercial traveller Charles Dickens, Pedro Tena classic_literature 1776 rgb(146, 113, 100)"
White Fang,Jack London,1905,classic_literature,http://covers.openlibrary.org/b/id/8236920-L.jpg,book_covers\2862_White_Fang.jpg,2862,"rgb(111, 79, 26)","White Fang Jack London classic_literature 1905 rgb(111, 79, 26)"
Meditations,Marcus Aurelius,1626,classic_literature,http://covers.openlibrary.org/b/id/211529-L.jpg,book_covers\2863_Meditations.jpg,2863,"rgb(152, 152, 118)","Meditations Marcus Aurelius classic_literature 1626 rgb(152, 152, 118)"
Greenmantle,John Buchan,1915,classic_literature,http://covers.openlibrary.org/b/id/93023-L.jpg,book_covers\2864_Greenmantle.jpg,2864,"rgb(225, 167, 154)","Greenmantle John Buchan classic_literature 1915 rgb(225, 167, 154)"
The Strange Case of Dr. Jekyll and Mr. Hyde,Robert Louis Stevenson,1875,classic_literature,http://covers.openlibrary.org/b/id/295773-L.jpg,book_covers\2865_The_Strange_Case_of_Dr._Jekyll_and_Mr._Hyde.jpg,2865,"rgb(61, 58, 60)","The Strange Case of Dr. Jekyll and Mr. Hyde Robert Louis Stevenson classic_literature 1875 rgb(61, 58, 60)"
An Old-Fashioned Girl,Louisa May Alcott,1869,classic_literature,http://covers.openlibrary.org/b/id/8244533-L.jpg,book_covers\2866_An_Old-Fashioned_Girl.jpg,2866,"rgb(32, 12, 16)","An Old-Fashioned Girl Louisa May Alcott classic_literature 1869 rgb(32, 12, 16)"
The Jungle,Upton Sinclair,1905,classic_literature,http://covers.openlibrary.org/b/id/8231790-L.jpg,book_covers\2867_The_Jungle.jpg,2867,"rgb(75, 67, 20)","The Jungle Upton Sinclair classic_literature 1905 rgb(75, 67, 20)"
Herland,Charlotte Perkins Gilman,1915,classic_literature,http://covers.openlibrary.org/b/id/448130-L.jpg,book_covers\2868_Herland.jpg,2868,"rgb(178, 176, 166)","Herland Charlotte Perkins Gilman classic_literature 1915 rgb(178, 176, 166)"
Kidnapped,Robert Louis Stevenson,1886,classic_literature,http://covers.openlibrary.org/b/id/8267822-L.jpg,book_covers\2869_Kidnapped.jpg,2869,"rgb(234, 226, 211)","Kidnapped Robert Louis Stevenson classic_literature 1886 rgb(234, 226, 211)"
Barnaby Rudge,"Charles Dickens, Eileen Warren Norris",1840,classic_literature,http://covers.openlibrary.org/b/id/9283961-L.jpg,book_covers\2870_Barnaby_Rudge.jpg,2870,"rgb(67, 92, 67)","Barnaby Rudge Charles Dickens, Eileen Warren Norris classic_literature 1840 rgb(67, 92, 67)"
"The sketch-book of Geoffrey Crayon, Esq",Washington Irving,1819,classic_literature,http://covers.openlibrary.org/b/id/7162030-L.jpg,"book_covers\2871_The_sketch-book_of_Geoffrey_Crayon,_Esq.jpg",2871,"rgb(207, 201, 190)","The sketch-book of Geoffrey Crayon, Esq Washington Irving classic_literature 1819 rgb(207, 201, 190)"
"The Federalist, or, The New Constitution","Alexander Hamilton, James Madison, John Jay",1788,classic_literature,http://covers.openlibrary.org/b/id/14850185-L.jpg,"book_covers\2872_The_Federalist,_or,_The_New_Constitution.jpg",2872,"rgb(104, 102, 105)","The Federalist, or, The New Constitution Alexander Hamilton, James Madison, John Jay classic_literature 1788 rgb(104, 102, 105)"
The Awakening,Kate Chopin,1899,classic_literature,http://covers.openlibrary.org/b/id/8750241-L.jpg,book_covers\2873_The_Awakening.jpg,2873,"rgb(166, 171, 157)","The Awakening Kate Chopin classic_literature 1899 rgb(166, 171, 157)"
The Poison Belt,Arthur Conan Doyle,1913,classic_literature,http://covers.openlibrary.org/b/id/5788361-L.jpg,book_covers\2874_The_Poison_Belt.jpg,2874,"rgb(79, 81, 74)","The Poison Belt Arthur Conan Doyle classic_literature 1913 rgb(79, 81, 74)"
Lord Jim,Joseph Conrad,1900,classic_literature,http://covers.openlibrary.org/b/id/8236295-L.jpg,book_covers\2875_Lord_Jim.jpg,2875,"rgb(67, 74, 54)","Lord Jim Joseph Conrad classic_literature 1900 rgb(67, 74, 54)"
A Portrait of the Artist as a Young Man,James Joyce,1818,classic_literature,http://covers.openlibrary.org/b/id/9328410-L.jpg,book_covers\2876_A_Portrait_of_the_Artist_as_a_Young_Man.jpg,2876,"rgb(24, 61, 85)","A Portrait of the Artist as a Young Man James Joyce classic_literature 1818 rgb(24, 61, 85)"
Sons and Lovers,D. H. Lawrence,1913,classic_literature,http://covers.openlibrary.org/b/id/8246175-L.jpg,book_covers\2877_Sons_and_Lovers.jpg,2877,"rgb(12, 13, 18)","Sons and Lovers D. H. Lawrence classic_literature 1913 rgb(12, 13, 18)"
Little Lord Fauntleroy,Frances Hodgson Burnett,1886,classic_literature,http://covers.openlibrary.org/b/id/29376-L.jpg,book_covers\2878_Little_Lord_Fauntleroy.jpg,2878,"rgb(167, 180, 180)","Little Lord Fauntleroy Frances Hodgson Burnett classic_literature 1886 rgb(167, 180, 180)"
The House of the Seven Gables,Nathaniel Hawthorne,1851,classic_literature,http://covers.openlibrary.org/b/id/8241487-L.jpg,book_covers\2879_The_House_of_the_Seven_Gables.jpg,2879,"rgb(141, 49, 38)","The House of the Seven Gables Nathaniel Hawthorne classic_literature 1851 rgb(141, 49, 38)"
Burning Daylight,Jack London,1910,classic_literature,http://covers.openlibrary.org/b/id/8245391-L.jpg,book_covers\2880_Burning_Daylight.jpg,2880,"rgb(75, 101, 134)","Burning Daylight Jack London classic_literature 1910 rgb(75, 101, 134)"
The Warden,Anthony Trollope,1809,classic_literature,http://covers.openlibrary.org/b/id/8238730-L.jpg,book_covers\2881_The_Warden.jpg,2881,"rgb(13, 37, 21)","The Warden Anthony Trollope classic_literature 1809 rgb(13, 37, 21)"
The Elusive Pimpernel (Scarlet Pimpernel),"Emmuska Orczy, Baroness Orczy",1908,classic_literature,http://covers.openlibrary.org/b/id/502823-L.jpg,book_covers\2882_The_Elusive_Pimpernel_(Scarlet_Pimpernel).jpg,2882,"rgb(124, 47, 51)","The Elusive Pimpernel (Scarlet Pimpernel) Emmuska Orczy, Baroness Orczy classic_literature 1908 rgb(124, 47, 51)"
Mr. Standfast,John Buchan,1919,classic_literature,http://covers.openlibrary.org/b/id/6962564-L.jpg,book_covers\2883_Mr._Standfast.jpg,2883,"rgb(111, 107, 87)","Mr. Standfast John Buchan classic_literature 1919 rgb(111, 107, 87)"
Puck of Pook's Hill,Rudyard Kipling,1900,classic_literature,http://covers.openlibrary.org/b/id/8242296-L.jpg,book_covers\2884_Puck_of_Pook's_Hill.jpg,2884,"rgb(218, 149, 53)","Puck of Pook's Hill Rudyard Kipling classic_literature 1900 rgb(218, 149, 53)"
Two years before the mast,Richard Henry Dana,1000,classic_literature,http://covers.openlibrary.org/b/id/8245243-L.jpg,book_covers\2885_Two_years_before_the_mast.jpg,2885,"rgb(66, 31, 15)","Two years before the mast Richard Henry Dana classic_literature 1000 rgb(66, 31, 15)"
Our Mutual Friend,"Charles Dickens, Margeret Tarner, Adam Leverton",1800,classic_literature,http://covers.openlibrary.org/b/id/13136200-L.jpg,book_covers\2886_Our_Mutual_Friend.jpg,2886,"rgb(49, 11, 11)","Our Mutual Friend Charles Dickens, Margeret Tarner, Adam Leverton classic_literature 1800 rgb(49, 11, 11)"
Rodney Stone,Arthur Conan Doyle,1896,classic_literature,http://covers.openlibrary.org/b/id/2893764-L.jpg,book_covers\2887_Rodney_Stone.jpg,2887,"rgb(107, 119, 119)","Rodney Stone Arthur Conan Doyle classic_literature 1896 rgb(107, 119, 119)"
Satyricon,Petronius Arbiter,1575,classic_literature,http://covers.openlibrary.org/b/id/6060585-L.jpg,book_covers\2888_Satyricon.jpg,2888,"rgb(198, 163, 123)","Satyricon Petronius Arbiter classic_literature 1575 rgb(198, 163, 123)"
Jacob's Room,Virginia Woolf,1922,classic_literature,http://covers.openlibrary.org/b/id/2894970-L.jpg,book_covers\2889_Jacob's_Room.jpg,2889,"rgb(97, 95, 76)","Jacob's Room Virginia Woolf classic_literature 1922 rgb(97, 95, 76)"
Cyrano de Bergerac,Edmond Rostand,1821,classic_literature,http://covers.openlibrary.org/b/id/8236320-L.jpg,book_covers\2890_Cyrano_de_Bergerac.jpg,2890,"rgb(61, 46, 40)","Cyrano de Bergerac Edmond Rostand classic_literature 1821 rgb(61, 46, 40)"
A strange disappearance,"Anna Katharine Green, Anna Katharine Green, Cyanide Publishing, Anna Katherine Green, Anna Green",1879,classic_literature,http://covers.openlibrary.org/b/id/12657405-L.jpg,book_covers\2891_A_strange_disappearance.jpg,2891,"rgb(191, 30, 28)","A strange disappearance Anna Katharine Green, Anna Katharine Green, Cyanide Publishing, Anna Katherine Green, Anna Green classic_literature 1879 rgb(191, 30, 28)"
Little Dorrit,"Charles Dickens, Mary Sebag-Montefiore, Adam Leverton",1800,classic_literature,http://covers.openlibrary.org/b/id/13113263-L.jpg,book_covers\2892_Little_Dorrit.jpg,2892,"rgb(93, 59, 17)","Little Dorrit Charles Dickens, Mary Sebag-Montefiore, Adam Leverton classic_literature 1800 rgb(93, 59, 17)"
Basil,"Wilkie Collins, Miguel Martínez-Lage",1852,classic_literature,http://covers.openlibrary.org/b/id/12968342-L.jpg,book_covers\2893_Basil.jpg,2893,"rgb(110, 50, 51)","Basil Wilkie Collins, Miguel Martínez-Lage classic_literature 1852 rgb(110, 50, 51)"
Dream days,"Kenneth Grahame, Ernest H. Shepard",1898,classic_literature,http://covers.openlibrary.org/b/id/5915025-L.jpg,book_covers\2894_Dream_days.jpg,2894,"rgb(239, 221, 189)","Dream days Kenneth Grahame, Ernest H. Shepard classic_literature 1898 rgb(239, 221, 189)"
Plain tales from the hills,Rudyard Kipling,1888,classic_literature,http://covers.openlibrary.org/b/id/8245216-L.jpg,book_covers\2895_Plain_tales_from_the_hills.jpg,2895,"rgb(42, 47, 21)","Plain tales from the hills Rudyard Kipling classic_literature 1888 rgb(42, 47, 21)"
Children of the Frost,Jack London,1800,classic_literature,http://covers.openlibrary.org/b/id/9383224-L.jpg,book_covers\2896_Children_of_the_Frost.jpg,2896,"rgb(117, 106, 95)","Children of the Frost Jack London classic_literature 1800 rgb(117, 106, 95)"
The Black Robe,"Wilkie Collins, Wilkie Collins",1881,classic_literature,http://covers.openlibrary.org/b/id/1759983-L.jpg,book_covers\2897_The_Black_Robe.jpg,2897,"rgb(146, 160, 152)","The Black Robe Wilkie Collins, Wilkie Collins classic_literature 1881 rgb(146, 160, 152)"
Pollyanna Grows Up,Eleanor Hodgman Porter,1915,classic_literature,http://covers.openlibrary.org/b/id/5831438-L.jpg,book_covers\2898_Pollyanna_Grows_Up.jpg,2898,"rgb(218, 218, 218)","Pollyanna Grows Up Eleanor Hodgman Porter classic_literature 1915 rgb(218, 218, 218)"
Dombey and Son,"Charles Dickens, Ian Perkin, A. Willis, Forster, John, Jason Lee",1800,classic_literature,http://covers.openlibrary.org/b/id/9283920-L.jpg,book_covers\2899_Dombey_and_Son.jpg,2899,"rgb(32, 43, 27)","Dombey and Son Charles Dickens, Ian Perkin, A. Willis, Forster, John, Jason Lee classic_literature 1800 rgb(32, 43, 27)"
Φαίδων,Πλάτων,1713,classic_literature,http://covers.openlibrary.org/b/id/14400104-L.jpg,book_covers\2900_Φαίδων.jpg,2900,error_reading,Φαίδων Πλάτων classic_literature 1713 error_reading
Il Paradiso,Dante Alighieri,1595,classic_literature,http://covers.openlibrary.org/b/id/6549496-L.jpg,book_covers\2901_Il_Paradiso.jpg,2901,"rgb(56, 44, 20)","Il Paradiso Dante Alighieri classic_literature 1595 rgb(56, 44, 20)"
Martin Chuzzlewit,"Charles Dickens, Tim F. LaHaye, Alfred Essarts",1800,classic_literature,http://covers.openlibrary.org/b/id/13112817-L.jpg,book_covers\2902_Martin_Chuzzlewit.jpg,2902,"rgb(84, 51, 15)","Martin Chuzzlewit Charles Dickens, Tim F. LaHaye, Alfred Essarts classic_literature 1800 rgb(84, 51, 15)"
The Street of Seven Stars,Mary Roberts Rinehart,1914,classic_literature,http://covers.openlibrary.org/b/id/5664897-L.jpg,book_covers\2903_The_Street_of_Seven_Stars.jpg,2903,"rgb(249, 245, 203)","The Street of Seven Stars Mary Roberts Rinehart classic_literature 1914 rgb(249, 245, 203)"
The Evil Shepherd,Edward Phillips Oppenheim,1922,classic_literature,http://covers.openlibrary.org/b/id/12648419-L.jpg,book_covers\2904_The_Evil_Shepherd.jpg,2904,"rgb(148, 127, 119)","The Evil Shepherd Edward Phillips Oppenheim classic_literature 1922 rgb(148, 127, 119)"
The Enchanted Island of Yew,L. Frank Baum,1903,classic_literature,http://covers.openlibrary.org/b/id/1755697-L.jpg,book_covers\2905_The_Enchanted_Island_of_Yew.jpg,2905,"rgb(116, 83, 58)","The Enchanted Island of Yew L. Frank Baum classic_literature 1903 rgb(116, 83, 58)"
The Age of Innocence,Edith Wharton,1920,classic_literature,http://covers.openlibrary.org/b/id/11196262-L.jpg,book_covers\2906_The_Age_of_Innocence.jpg,2906,"rgb(237, 205, 140)","The Age of Innocence Edith Wharton classic_literature 1920 rgb(237, 205, 140)"
Measure for Measure,William Shakespeare,1700,classic_literature,http://covers.openlibrary.org/b/id/7339281-L.jpg,book_covers\2907_Measure_for_Measure.jpg,2907,"rgb(137, 121, 84)","Measure for Measure William Shakespeare classic_literature 1700 rgb(137, 121, 84)"
Manon Lescaut,"Abbé Prévost, F. C. Green, felix crespo, Pr&eacute",1734,classic_literature,http://covers.openlibrary.org/b/id/8236918-L.jpg,book_covers\2908_Manon_Lescaut.jpg,2908,"rgb(240, 240, 240)","Manon Lescaut Abbé Prévost, F. C. Green, felix crespo, Pr&eacute classic_literature 1734 rgb(240, 240, 240)"
Memoirs of Fanny Hill,John Cleland,1749,classic_literature,http://covers.openlibrary.org/b/id/12947584-L.jpg,book_covers\2909_Memoirs_of_Fanny_Hill.jpg,2909,"rgb(82, 188, 157)","Memoirs of Fanny Hill John Cleland classic_literature 1749 rgb(82, 188, 157)"
The Wouldbegoods,Edith Nesbit,1901,classic_literature,http://covers.openlibrary.org/b/id/8243273-L.jpg,book_covers\2910_The_Wouldbegoods.jpg,2910,"rgb(118, 39, 15)","The Wouldbegoods Edith Nesbit classic_literature 1901 rgb(118, 39, 15)"
Le roman du masque de fer,Alexandre Dumas,1600,classic_literature,http://covers.openlibrary.org/b/id/2132494-L.jpg,book_covers\2911_Le_roman_du_masque_de_fer.jpg,2911,"rgb(133, 94, 44)","Le roman du masque de fer Alexandre Dumas classic_literature 1600 rgb(133, 94, 44)"
Framley Parsonage,Anthony Trollope,1861,classic_literature,http://covers.openlibrary.org/b/id/8288051-L.jpg,book_covers\2912_Framley_Parsonage.jpg,2912,"rgb(50, 39, 21)","Framley Parsonage Anthony Trollope classic_literature 1861 rgb(50, 39, 21)"
